{
  "schema_version": 1,
  "profile_id": "legaia-na-scus94254-field-v1",
  "game": "Legend of Legaia",
  "region": "North America",
  "executable_identity": {
    "serial": "SCUS-94254",
    "sha256": "292256e2e66db42727f613406785e444254d3f699569e611f65fcf1c6d2f3482",
    "file_size": 442368,
    "load_address": "0x80010000",
    "claim": {
      "property": "executable_identity",
      "value": "SCUS-94254:292256e2e66db42727f613406785e444254d3f699569e611f65fcf1c6d2f3482",
      "confidence": "confirmed",
      "evidence": ["psxrecomp-game-config", "local-disc-executable-hash"],
      "notes": "Hash computed locally from the ISO9660 SCUS_942.54 file; no executable bytes or local path are stored."
    }
  },
  "supported_runtime_protocol": {
    "name": "psxrecomp-json-tcp",
    "minimum_version": 1,
    "required_capabilities": [
      "ping",
      "read_ram",
      "frame",
      "canonical_overlay_identity"
    ]
  },
  "overlay_requirements": [
    {
      "required": true,
      "identity": {
        "id": "field-overlay-0897",
        "prot_entry": 897,
        "load_address": "0x801CE818",
        "content_sha256": null,
        "source_entry_sha256": "216f846db5ab085a295cef4064747380a06c995caa3e1b2773e78a1d349f126b"
      },
      "owner": "field overlay",
      "claim": {
        "property": "active_field_overlay",
        "value": "field-overlay-0897",
        "confidence": "strongly_inferred",
        "evidence": ["andrew-boot-mode-table", "andrew-field-overlay-functions", "local-disc-prot897-hash"],
        "notes": "PROT 897 and its slot-A base are supported by loader traces. The source-entry hash is not yet a canonical live-memory overlay hash, so required runtime content identity remains unresolved and profile selection fails closed."
      }
    }
  ],
  "scene_identity": {
    "scene_key": "town01",
    "strategy": "Require the active scene name, runtime PROT base index, field-run master mode, executable identity and canonical field-overlay identity to agree in two boundary samples.",
    "required_signals": [
      {
        "id": "active_scene_name",
        "address": "0x80084548",
        "width": 8,
        "type": "ascii_nul_terminated",
        "expected": "town01",
        "owner": "SCUS_942.54",
        "lifecycle": "Updated during named scene transition; valid active buffer after field initialization.",
        "claim": {
          "property": "active_scene_name",
          "value": "town01",
          "confidence": "confirmed",
          "evidence": ["andrew-asset-loader", "andrew-runtime-probes"],
          "notes": "The 0x8007050C pending/mirror name is supporting only and is not sufficient by itself."
        }
      },
      {
        "id": "active_scene_prot_base",
        "address": "0x80084540",
        "width": 2,
        "type": "u16_le",
        "expected": 3,
        "owner": "SCUS_942.54",
        "lifecycle": "Resolved from CDNAME and consumed by the retail field loader; changes for inter-scene transitions.",
        "claim": {
          "property": "town01_runtime_prot_base",
          "value": 3,
          "confidence": "confirmed",
          "evidence": ["retail-cdname", "andrew-field-loader-trace", "psxrecomp-importer"],
          "notes": "Runtime/CDNAME index 3 corresponds to extraction-frame start 1; the two numbering spaces must not be conflated."
        }
      },
      {
        "id": "master_game_mode",
        "address": "0x8007B83C",
        "width": 2,
        "type": "u16_le",
        "expected": 3,
        "owner": "SCUS_942.54",
        "lifecycle": "Mode 2 initializes the field; mode 3 is settled field/town gameplay and changes before other modes.",
        "claim": {
          "property": "field_run_mode",
          "value": 3,
          "confidence": "confirmed",
          "evidence": ["andrew-boot-mode-table", "andrew-runtime-probes"],
          "notes": "Mode 3 is necessary but not scene-specific."
        }
      }
    ]
  },
  "scene_epoch": {
    "observer_owned": true,
    "stability_samples": 2,
    "invalidation_signals": [
      "active_scene_name",
      "active_scene_prot_base",
      "master_game_mode",
      "field-overlay-0897",
      "actor_list_head",
      "actor_census_base"
    ],
    "contract": "Increment the observer-side epoch only after two boundary samples agree. Invalidate immediately on any signal change, field mode exit, overlay uncertainty, actor-list replacement or read-boundary mismatch; discard the mixed snapshot."
  },
  "actor_pool": {
    "storage_kind": "linked_nodes_with_pointer_census",
    "pointer_census": {
      "base_address": "0x801C93C8",
      "entry_stride": 4,
      "maximum_slots": 32,
      "count": {
        "address": "0x8007B6B8",
        "width": 4,
        "type": "u32_le",
        "claim": {
          "property": "field_actor_census_count",
          "value": "u32 capped at 32",
          "confidence": "strongly_inferred",
          "evidence": ["andrew-field-collision", "andrew-engine-shell-capture-tests", "andrew-s5-actor-probe"],
          "notes": "The field tests read u32; one older Lua probe reads u8 and world-map documentation assigns another mode-dependent meaning to this address. Ownership must be gated by field overlay and mode."
        }
      },
      "rebuild_function": "0x801CF754",
      "lifecycle": "Rebuilt each field frame from the live actor linked list, culling to actors near the player, skipping flags & 3, and capping at 32 entries.",
      "claim": {
        "property": "field_actor_pointer_census",
        "value": "0x801C93C8",
        "confidence": "strongly_inferred",
        "evidence": ["andrew-field-collision", "andrew-engine-shell-capture-tests"],
        "notes": "This is a collision/interaction candidate census, not the owning actor allocation pool and not a complete list of all MAN placements."
      }
    },
    "linked_list_head": {
      "address": "0x8007C354",
      "owner": "SCUS_942.54 global pointing to field actor nodes",
      "claim": {
        "property": "field_actor_list_head",
        "value": "0x8007C354",
        "confidence": "strongly_inferred",
        "evidence": ["andrew-memory-map", "andrew-field-collision-list-variant", "andrew-motion-vm"],
        "notes": "The global is one member of a multi-list actor system. List membership and per-mode meaning require the field-mode gate."
      }
    },
    "actor_record": {
      "allocation": "individually allocated linked node",
      "contiguous_stride": null,
      "bounded_read_size": 156,
      "alignment": 4,
      "claim": {
        "property": "actor_record_storage",
        "value": "linked variable-address nodes; safe observed prefix 0x9C bytes",
        "confidence": "strongly_inferred",
        "evidence": ["andrew-actor-allocators", "andrew-field-spawner", "andrew-field-collision"],
        "notes": "No evidence supports actor_base + slot*actor_stride. The 0x9C prefix ends after the collision-partner pointer; full allocation size and allocator free-list lifecycle remain unresolved."
      }
    },
    "initializers": ["0x80020DE0", "0x8003A1E4", "0x8003A55C"],
    "updaters": ["0x8002519C", "0x8003BC08", "0x801CF754"],
    "teardown": ["0x800204A4"],
    "unresolved": [
      "Exact allocator block size and free-list encoding.",
      "Whether every MAN partition-1 placement persists as a live node.",
      "Full ordering and inclusion rules for the 0x8007C354 list.",
      "Exact unlink/free boundary during scene teardown and same-scene slot reuse."
    ]
  },
  "actor_fields": [
    {
      "id": "next_actor",
      "offset": 0,
      "width": 4,
      "type": "ram_pointer",
      "signed": false,
      "representation": "KSEG0 pointer or zero",
      "observation": "safe",
      "correlation_value": "unsafe",
      "owner": "generic SCUS actor node",
      "claim": { "property": "linked_list_next", "value": 0, "confidence": "confirmed", "evidence": ["andrew-list-walker", "andrew-field-collision-list-variant"], "notes": "Structural traversal only; address is not semantic identity." }
    },
    {
      "id": "tick_function",
      "offset": 12,
      "width": 4,
      "type": "code_pointer",
      "signed": false,
      "representation": "SCUS or active-overlay VA",
      "observation": "conditional",
      "correlation_value": "supporting",
      "owner": "generic SCUS actor node",
      "claim": { "property": "tick_function", "value": 12, "confidence": "confirmed", "evidence": ["andrew-memory-map", "andrew-list-walker"], "notes": "Overlay-local values require overlay identity before interpretation." }
    },
    {
      "id": "flags",
      "offset": 16,
      "width": 4,
      "type": "u32_le",
      "signed": false,
      "representation": "bitfield",
      "observation": "safe",
      "correlation_value": "supporting",
      "owner": "generic SCUS actor node",
      "claim": { "property": "flags", "value": 16, "confidence": "confirmed", "evidence": ["andrew-field-collision", "andrew-field-interaction"], "notes": "Only individually traced bits may be interpreted; flags & 3 disables candidate inclusion and 0x20000 selects the moving collision class." }
    },
    {
      "id": "position_x",
      "offset": 20,
      "width": 2,
      "type": "i16_le",
      "signed": true,
      "representation": "integer world units",
      "observation": "safe",
      "correlation_value": "supporting",
      "owner": "field actor node",
      "claim": { "property": "position_x", "value": 20, "confidence": "confirmed", "evidence": ["andrew-locomotion-writer-trace", "andrew-field-collision"], "notes": "Mutable; compare within one scene epoch only." }
    },
    {
      "id": "position_y",
      "offset": 22,
      "width": 2,
      "type": "i16_le",
      "signed": true,
      "representation": "integer world units",
      "observation": "safe",
      "correlation_value": "weak",
      "owner": "field actor node",